{
  "descriptor_version": "1.0",
  "vendor": "eu.sonata-nfv.service-descriptor",
  "name": "RTMP_sniffer",
  "version": "1.0",
  "author": "Hadi Razzaghi Kouchaksaraei",
  "description": "A service providing RTMP packet sniffer and recorder",
  "cloud_services": [
    {
      "service_id": "VNF_sink",
      "service_vendor": "eu.sonata-nfv.cloud-service-descriptor",
      "service_name": "VNF_sink",
      "service_version": "1.0"
    }
  ]
}
