{
  "descriptor_version": "1.0",
  "vendor": "eu.sonata-nfv.service-descriptor",
  "name": "ping-pong",
  "version": "1.0",
  "author": "Hadi Razzaghi",
  "description": "ping-pong example.",
  "network_functions": [
    {
      "vnf_id": "vm-ping",
      "vnf_vendor": "eu.sonata-nfv.vnf-descriptor",
      "vnf_name": "ping-vm-vnf",
      "vnf_version": "1.0"
    }
  ],
  "cloud_services": [
    {
      "service_id": "ping",
      "service_vendor": "eu.sonata-nfv.cloud-service-descriptor",
      "service_name": "ping-cn-vnf",
      "service_version": "1.0"
    }
  ],
  "forwarding_graphs": [
    {
      "fg_id": "ns:fg01",
      "number_of_endpoints": 2,
      "number_of_virtual_links": 3,
      "constituent_vnfs": [
        "ping-vm-vnf",
        "ping-cn-vnf"
      ],
      "network_forwarding_paths": [
        {
          "fp_id": "ns:fg01:fp01",
          "policy": "none",
          "connection_points": [
            {
              "connection_point_ref": "input",
              "position": 1
            },
            {
              "connection_point_ref": "ping-vm-vnf:eth0",
              "position": 2
            },
            {
              "connection_point_ref": "ping-cn-vnf:eth0",
              "position": 3
            },
            {
              "connection_point_ref": "output",
              "position": 4
            }
          ]
        }
      ]
    }
  ]
}
